Codec: Analog Devices AD1882
Address: 2
AFG Function Id: 0x1 (unsol 0)
Vendor Id: 0x11d41882
Subsystem Id: 0x17aa3049
Revision Id: 0x100300
No Modem Function Group found
Default PCM:
    rates [0x1ff]: 8000 11025 16000 22050 32000 44100 48000 88200 96000
    bits [0xe]: 16 20 24
    formats [0x1]: PCM
Default Amp-In caps: ofs=0x00, nsteps=0x00, stepsize=0x00, mute=1
Default Amp-Out caps: ofs=0x27, nsteps=0x27, stepsize=0x05, mute=0
State of AFG node 0x01:
  Power states:  D0 D3
  Power: setting=D0, actual=D0
GPIO: io=2, o=0, i=0, unsolicited=1, wake=0
  IO[0]: enable=0, dir=0, wake=0, sticky=0, data=0, unsol=0
  IO[1]: enable=0, dir=0, wake=0, sticky=0, data=1, unsol=0
Node 0x02 [Audio Output] wcaps 0x3031d: Stereo Digital Amp-Out
  Amp-Out caps: ofs=0x27, nsteps=0x27, stepsize=0x05, mute=1
  Amp-Out vals:  [0xa7 0xa7]
  Converter: stream=0, channel=0
  Digital:
  Digital category: 0x0
  IEC Coding Type: 0x0
  PCM:
    rates [0x1e0]: 44100 48000 88200 96000
    bits [0xe]: 16 20 24
    formats [0x5]: PCM AC3
  Delay: 3 samples
  Connection: 1
     0x1d
Node 0x03 [Audio Output] wcaps 0x405: Stereo Amp-Out
  Control: name="Surround Playback Volume", index=0, device=0
    ControlAmp: chs=3, dir=Out, idx=0, ofs=0
  Amp-Out caps: ofs=0x27, nsteps=0x27, stepsize=0x05, mute=0
  Amp-Out vals:  [0x16 0x16]
  Converter: stream=5, channel=0
  Power states:  D0 D3
  Power: setting=D0, actual=D0
Node 0x04 [Audio Output] wcaps 0x405: Stereo Amp-Out
  Control: name="Headphone+LO Playback Volume", index=0, device=0
    ControlAmp: chs=3, dir=Out, idx=0, ofs=0
  Device: name="AD1882 Analog", type="Audio", device=0
  Device: name="AD1882 Alt Analog", type="Audio", device=2
  Amp-Out caps: ofs=0x27, nsteps=0x27, stepsize=0x05, mute=0
  Amp-Out vals:  [0x00 0x00]
  Converter: stream=5, channel=0
  Power states:  D0 D3
  Power: setting=D0, actual=D0
Node 0x05 [Audio Output] wcaps 0x405: Stereo Amp-Out
  Control: name="Center Playback Volume", index=0, device=0
    ControlAmp: chs=1, dir=Out, idx=0, ofs=0
  Control: name="LFE Playback Volume", index=0, device=0
    ControlAmp: chs=2, dir=Out, idx=0, ofs=0
  Amp-Out caps: ofs=0x27, nsteps=0x27, stepsize=0x05, mute=0
  Amp-Out vals:  [0x16 0x16]
  Converter: stream=5, channel=0
  Power states:  D0 D3
  Power: setting=D0, actual=D0
Node 0x06 [Vendor Defined Widget] wcaps 0xf00000: Mono
Node 0x07 [Vendor Defined Widget] wcaps 0xf00000: Mono
Node 0x08 [Audio Input] wcaps 0x100501: Stereo
  Device: name="AD1882 Analog", type="Audio", device=0
  Converter: stream=0, channel=0
  SDI-Select: 0
  Power states:  D0 D3
  Power: setting=D0, actual=D0
  Connection: 1
     0x0c
Node 0x09 [Audio Input] wcaps 0x100501: Stereo
  Device: name="AD1882 Alt Analog", type="Audio", device=2
  Converter: stream=0, channel=0
  SDI-Select: 0
  Power states:  D0 D3
  Power: setting=D0, actual=D0
  Connection: 1
     0x0d
Node 0x0a [Vendor Defined Widget] wcaps 0xf00000: Mono
Node 0x0b [Audio Selector] wcaps 0x300301: Stereo Digital
  Connection: 2
     0x08* 0x09
Node 0x0c [Audio Selector] wcaps 0x30010d: Stereo Amp-Out
  Control: name="Capture Volume", index=0, device=0
    ControlAmp: chs=3, dir=Out, idx=0, ofs=0
  Control: name="Capture Switch", index=0, device=0
    ControlAmp: chs=3, dir=Out, idx=0, ofs=0
  Amp-Out caps: ofs=0x27, nsteps=0x36, stepsize=0x05, mute=1
  Amp-Out vals:  [0x2f 0x2f]
  Connection: 10
     0x11 0x39 0x3a* 0x3b 0x3c 0x18 0x3b 0x3b 0x12 0x20
Node 0x0d [Audio Selector] wcaps 0x30010d: Stereo Amp-Out
  Control: name="Capture Volume", index=1, device=0
    ControlAmp: chs=3, dir=Out, idx=0, ofs=0
  Control: name="Capture Switch", index=1, device=0
    ControlAmp: chs=3, dir=Out, idx=0, ofs=0
  Amp-Out caps: ofs=0x27, nsteps=0x36, stepsize=0x05, mute=1
  Amp-Out vals:  [0x9c 0x9c]
  Connection: 10
     0x11 0x39 0x3a 0x3b 0x3c* 0x18 0x3b 0x3b 0x12 0x20
Node 0x0e [Vendor Defined Widget] wcaps 0xf00000: Mono
Node 0x0f [Vendor Defined Widget] wcaps 0xf00000: Mono
Node 0x10 [Beep Generator Widget] wcaps 0x70000c: Mono Amp-Out
  Control: name="Beep Playback Volume", index=0, device=0
    ControlAmp: chs=1, dir=Out, idx=0, ofs=0
  Control: name="Beep Playback Switch", index=0, device=0
    ControlAmp: chs=1, dir=Out, idx=0, ofs=0
  Amp-Out caps: ofs=0x0f, nsteps=0x0f, stepsize=0x0b, mute=1
  Amp-Out vals:  [0x84]
Node 0x11 [Pin Complex] wcaps 0x40018d: Stereo Amp-Out
  Control: name="Headphone Playback Switch", index=0, device=0
    ControlAmp: chs=3, dir=Out, idx=0, ofs=0
  Amp-Out caps: ofs=0x00, nsteps=0x00, stepsize=0x00, mute=1
  Amp-Out vals:  [0x80 0x80]
  Pincap 0x0000003f: IN OUT HP Detect Trigger ImpSense
  Pin Default 0x02214030: [Jack] HP Out at Ext Front
    Conn = 1/8, Color = Green
    DefAssociation = 0x3, Sequence = 0x0
  Pin-ctls: 0xc0: OUT HP
  Unsolicited: tag=01, enabled=1
  Connection: 1
     0x22
Node 0x12 [Pin Complex] wcaps 0x40058d: Stereo Amp-Out
  Control: name="Front Playback Switch", index=0, device=0
    ControlAmp: chs=3, dir=Out, idx=0, ofs=0
  Amp-Out caps: ofs=0x00, nsteps=0x00, stepsize=0x00, mute=1
  Amp-Out vals:  [0x00 0x00]
  Pincap 0x0001003f: IN OUT HP EAPD Detect Trigger ImpSense
  EAPD 0x2: EAPD
  Pin Default 0x01014010: [Jack] Line Out at Ext Rear
    Conn = 1/8, Color = Green
    DefAssociation = 0x1, Sequence = 0x0
  Pin-ctls: 0x40: OUT
  Unsolicited: tag=02, enabled=1
  Power states:  D0 D3
  Power: setting=D0, actual=D0
  Connection: 1
     0x29
Node 0x13 [Pin Complex] wcaps 0x40050c: Mono Amp-Out
  Control: name="Speaker Playback Volume", index=0, device=0
    ControlAmp: chs=1, dir=Out, idx=0, ofs=0
  Control: name="Speaker Playback Switch", index=0, device=0
    ControlAmp: chs=1, dir=Out, idx=0, ofs=0
  Amp-Out caps: ofs=0x1f, nsteps=0x1f, stepsize=0x05, mute=1
  Amp-Out vals:  [0x0e]
  Pincap 0x00010010: OUT EAPD
  EAPD 0x2: EAPD
  Pin Default 0x911711f0: [Fixed] Speaker at Int Rear
    Conn = Analog, Color = Black
    DefAssociation = 0xf, Sequence = 0x0
    Misc = NO_PRESENCE
  Pin-ctls: 0x40: OUT
  Power states:  D0 D3
  Power: setting=D0, actual=D0
  Connection: 1
     0x2d
Node 0x14 [Pin Complex] wcaps 0x400081: Stereo
  Pincap 0x00003727: IN Detect Trigger ImpSense
    Vref caps: HIZ 50 GRD 80 100
  Pin Default 0x02a19021: [Jack] Mic at Ext Front
    Conn = 1/8, Color = Pink
    DefAssociation = 0x2, Sequence = 0x1
  Pin-ctls: 0x24: IN VREF_80
  Unsolicited: tag=03, enabled=1
Node 0x15 [Pin Complex] wcaps 0x40018d: Stereo Amp-Out
  Control: name="Surround Playback Switch", index=0, device=0
    ControlAmp: chs=3, dir=Out, idx=0, ofs=0
  Amp-Out caps: ofs=0x00, nsteps=0x00, stepsize=0x00, mute=1
  Amp-Out vals:  [0x00 0x00]
  Pincap 0x00003737: IN OUT Detect Trigger ImpSense
    Vref caps: HIZ 50 GRD 80 100
  Pin Default 0x0181302e: [Jack] Line In at Ext Rear
    Conn = 1/8, Color = Blue
    DefAssociation = 0x2, Sequence = 0xe
  Pin-ctls: 0x20: IN VREF_HIZ
  Unsolicited: tag=05, enabled=1
  Connection: 1
     0x2c
Node 0x16 [Pin Complex] wcaps 0x40018d: Stereo Amp-Out
  Amp-Out caps: ofs=0x00, nsteps=0x00, stepsize=0x00, mute=1
  Amp-Out vals:  [0x80 0x80]
  Pincap 0x00000017: OUT Detect Trigger ImpSense
  Pin Default 0x41011012: [N/A] Line Out at Ext Rear
    Conn = 1/8, Color = Black
    DefAssociation = 0x1, Sequence = 0x2
  Pin-ctls: 0x40: OUT
  Unsolicited: tag=00, enabled=0
  Connection: 1
     0x2a
Node 0x17 [Pin Complex] wcaps 0x40098d: Stereo Amp-Out R/L
  Control: name="Center Playback Switch", index=0, device=0
    ControlAmp: chs=1, dir=Out, idx=0, ofs=0
  Control: name="LFE Playback Switch", index=0, device=0
    ControlAmp: chs=2, dir=Out, idx=0, ofs=0
  Amp-Out caps: ofs=0x00, nsteps=0x00, stepsize=0x00, mute=1
  Amp-Out vals:  [0x00 0x00]
  Pincap 0x00003737: IN OUT Detect Trigger ImpSense
    Vref caps: HIZ 50 GRD 80 100
  Pin Default 0x01a19020: [Jack] Mic at Ext Rear
    Conn = 1/8, Color = Pink
    DefAssociation = 0x2, Sequence = 0x0
  Pin-ctls: 0x24: IN VREF_80
  Unsolicited: tag=04, enabled=1
  Connection: 1
     0x26
Node 0x18 [Pin Complex] wcaps 0x400001: Stereo
  Pincap 0x00000020: IN
  Pin Default 0x99331122: [Fixed] CD at Int ATAPI
    Conn = ATAPI, Color = Black
    DefAssociation = 0x2, Sequence = 0x2
    Misc = NO_PRESENCE
  Pin-ctls: 0x20: IN
Node 0x19 [Power Widget] wcaps 0x500500: Mono
  Power states:  D0 D3
  Power: setting=D0, actual=D0
  Connection: 2
     0x20 0x21
Node 0x1a [Pin Complex] wcaps 0x400000: Mono
  Pincap 0x00000020: IN
  Pin Default 0x91f711f0: [Fixed] Other at Int Rear
    Conn = Analog, Color = Black
    DefAssociation = 0xf, Sequence = 0x0
    Misc = NO_PRESENCE
  Pin-ctls: 0x20: IN
Node 0x1b [Pin Complex] wcaps 0x400301: Stereo Digital
  Pincap 0x00000010: OUT
  Pin Default 0x4145f1a0: [N/A] SPDIF Out at Ext Rear
    Conn = Optical, Color = Other
    DefAssociation = 0xa, Sequence = 0x0
    Misc = NO_PRESENCE
  Pin-ctls: 0x40: OUT
  Connection: 1
     0x02
Node 0x1c [Vendor Defined Widget] wcaps 0xf00000: Mono
Node 0x1d [Audio Mixer] wcaps 0x200303: Stereo Digital Amp-In
  Amp-In caps: ofs=0x00, nsteps=0x00, stepsize=0x00, mute=1
  Amp-In vals:  [0x00 0x00] [0x80 0x80]
  Connection: 2
     0x01 0x0b
Node 0x1e [Audio Mixer] wcaps 0x200103: Stereo Amp-In
  Amp-In caps: ofs=0x00, nsteps=0x00, stepsize=0x00, mute=1
  Amp-In vals:  [0x00 0x00] [0x80 0x80]
  Connection: 2
     0x04 0x21
Node 0x1f [Vendor Defined Widget] wcaps 0xf00301: Stereo Digital
  Connection: 1
     0x02
Node 0x20 [Audio Mixer] wcaps 0x20010b: Stereo Amp-In
  Control: name="Front Mic Playback Volume", index=0, device=0
    ControlAmp: chs=3, dir=In, idx=0, ofs=0
  Control: name="Front Mic Playback Switch", index=0, device=0
    ControlAmp: chs=3, dir=In, idx=0, ofs=0
  Control: name="Rear Mic Playback Volume", index=0, device=0
    ControlAmp: chs=3, dir=In, idx=4, ofs=0
  Control: name="Rear Mic Playback Switch", index=0, device=0
    ControlAmp: chs=3, dir=In, idx=4, ofs=0
  Control: name="Line Playback Volume", index=0, device=0
    ControlAmp: chs=3, dir=In, idx=1, ofs=0
  Control: name="Line Playback Switch", index=0, device=0
    ControlAmp: chs=3, dir=In, idx=1, ofs=0
  Control: name="CD Playback Volume", index=0, device=0
    ControlAmp: chs=3, dir=In, idx=6, ofs=0
  Control: name="CD Playback Switch", index=0, device=0
    ControlAmp: chs=3, dir=In, idx=6, ofs=0
  Amp-In caps: ofs=0x17, nsteps=0x1f, stepsize=0x05, mute=1
  Amp-In vals:  [0x80 0x80] [0x80 0x80] [0x80 0x80] [0x80 0x80] [0x80 0x80] [0x80 0x80] [0x80 0x80] [0x80 0x80]
  Connection: 8
     0x39 0x3a 0x11 0x12 0x3c 0x3b 0x18 0x1a
Node 0x21 [Audio Selector] wcaps 0x30010d: Stereo Amp-Out
  Amp-Out caps: ofs=0x1f, nsteps=0x1f, stepsize=0x05, mute=1
  Amp-Out vals:  [0x1f 0x1f]
  Connection: 1
     0x20
Node 0x22 [Audio Mixer] wcaps 0x200103: Stereo Amp-In
  Amp-In caps: ofs=0x00, nsteps=0x00, stepsize=0x00, mute=1
  Amp-In vals:  [0x00 0x00] [0x80 0x80]
  Connection: 2
     0x37 0x21
Node 0x23 [Vendor Defined Widget] wcaps 0xf00100: Mono
  Connection: 35
     0x11* 0x12 0x13 0x14 0x15 0x16 0x17 0x18 0x20 0x21 0x22 0x24 0x25 0x26 0x27 0x28 0x29 0x2a 0x2b 0x2c 0x2d 0x2e 0x30 0x31 0x32 0x33 0x34 0x35 0x36 0x37 0x38 0x39 0x3a 0x3b 0x3c
Node 0x24 [Pin Complex] wcaps 0x40098d: Stereo Amp-Out R/L
  Amp-Out caps: ofs=0x00, nsteps=0x00, stepsize=0x00, mute=1
  Amp-Out vals:  [0x80 0x80]
  Pincap 0x00000017: OUT Detect Trigger ImpSense
  Pin Default 0x41016011: [N/A] Line Out at Ext Rear
    Conn = 1/8, Color = Orange
    DefAssociation = 0x1, Sequence = 0x1
  Pin-ctls: 0x40: OUT
  Unsolicited: tag=00, enabled=0
  Connection: 1
     0x27
Node 0x25 [Vendor Defined Widget] wcaps 0xf00000: Mono
Node 0x26 [Audio Mixer] wcaps 0x200103: Stereo Amp-In
  Amp-In caps: ofs=0x00, nsteps=0x00, stepsize=0x00, mute=1
  Amp-In vals:  [0x80 0x80] [0x80 0x80]
  Connection: 2
     0x05 0x21
Node 0x27 [Audio Mixer] wcaps 0x200103: Stereo Amp-In
  Amp-In caps: ofs=0x00, nsteps=0x00, stepsize=0x00, mute=1
  Amp-In vals:  [0x80 0x80] [0x80 0x80]
  Connection: 2
     0x05 0x21
Node 0x28 [Vendor Defined Widget] wcaps 0xf00000: Mono
Node 0x29 [Audio Mixer] wcaps 0x200103: Stereo Amp-In
  Amp-In caps: ofs=0x00, nsteps=0x00, stepsize=0x00, mute=1
  Amp-In vals:  [0x00 0x00] [0x80 0x80]
  Connection: 2
     0x04 0x21
Node 0x2a [Audio Mixer] wcaps 0x200103: Stereo Amp-In
  Amp-In caps: ofs=0x00, nsteps=0x00, stepsize=0x00, mute=1
  Amp-In vals:  [0x80 0x80] [0x80 0x80]
  Connection: 2
     0x03 0x21
Node 0x2b [Vendor Defined Widget] wcaps 0xf00000: Mono
Node 0x2c [Audio Mixer] wcaps 0x200103: Stereo Amp-In
  Amp-In caps: ofs=0x00, nsteps=0x00, stepsize=0x00, mute=1
  Amp-In vals:  [0x80 0x80] [0x80 0x80]
  Connection: 2
     0x03 0x21
Node 0x2d [Audio Mixer] wcaps 0x200100: Mono
  Connection: 1
     0x1e
Node 0x2e [Vendor Defined Widget] wcaps 0xf00000: Mono
Node 0x2f [Vendor Defined Widget] wcaps 0xf00100: Mono
  Connection: 3
     0x14* 0x15 0x17
Node 0x30 [Vendor Defined Widget] wcaps 0xf00000: Mono
Node 0x31 [Vendor Defined Widget] wcaps 0xf00000: Mono
Node 0x32 [Vendor Defined Widget] wcaps 0xf00000: Mono
Node 0x33 [Vendor Defined Widget] wcaps 0xf00000: Mono
Node 0x34 [Vendor Defined Widget] wcaps 0xf00000: Mono
Node 0x35 [Vendor Defined Widget] wcaps 0xf00000: Mono
Node 0x36 [Vendor Defined Widget] wcaps 0xf00000: Mono
Node 0x37 [Audio Selector] wcaps 0x300101: Stereo
  Connection: 2
     0x03 0x04*
Node 0x38 [Vendor Defined Widget] wcaps 0xf00000: Mono
Node 0x39 [Audio Selector] wcaps 0x30010d: Stereo Amp-Out
  Control: name="Front Mic Boost Volume", index=0, device=0
    ControlAmp: chs=3, dir=Out, idx=0, ofs=0
  Amp-Out caps: ofs=0x00, nsteps=0x03, stepsize=0x27, mute=0
  Amp-Out vals:  [0x00 0x00]
  Connection: 1
     0x14
Node 0x3a [Audio Selector] wcaps 0x30010d: Stereo Amp-Out
  Control: name="Line Boost Volume", index=0, device=0
    ControlAmp: chs=3, dir=Out, idx=0, ofs=0
  Amp-Out caps: ofs=0x00, nsteps=0x03, stepsize=0x27, mute=0
  Amp-Out vals:  [0x00 0x00]
  Connection: 1
     0x15
Node 0x3b [Vendor Defined Widget] wcaps 0xf00000: Mono
Node 0x3c [Audio Selector] wcaps 0x30010d: Stereo Amp-Out
  Control: name="Rear Mic Boost Volume", index=0, device=0
    ControlAmp: chs=3, dir=Out, idx=0, ofs=0
  Amp-Out caps: ofs=0x00, nsteps=0x03, stepsize=0x27, mute=0
  Amp-Out vals:  [0x00 0x00]
  Connection: 1
     0x17
