00:00.0 Host bridge [0600]: Intel Corporation 4 Series Chipset DRAM Controller [8086:2e10] (rev 03)
	Subsystem: Lenovo 4 Series Chipset DRAM Controller [17aa:3049]
	Control: I/O- Mem+ BusMaster+ SpecCycle- MemWINV- VGASnoop- ParErr- Stepping- SERR+ FastB2B- DisINTx-
	Status: Cap+ 66MHz- UDF- FastB2B+ ParErr- DEVSEL=fast >TAbort- <TAbort- <MAbort+ >SERR- <PERR- INTx-
	Latency: 0
	Capabilities: <access denied>
00: 86 80 10 2e 06 01 90 20 03 00 00 06 00 00 00 00
10: 00 00 00 00 00 00 00 00 00 00 00 00 00 00 00 00
20: 00 00 00 00 00 00 00 00 00 00 00 00 aa 17 49 30
30: 00 00 00 00 e0 00 00 00 00 00 00 00 00 00 00 00

00:02.0 VGA compatible controller [0300]: Intel Corporation 4 Series Chipset Integrated Graphics Controller [8086:2e12] (rev 03) (prog-if 00 [VGA controller])
	Subsystem: Lenovo 4 Series Chipset Integrated Graphics Controller [17aa:3049]
	Control: I/O+ Mem+ BusMaster+ SpecCycle- MemWINV- VGASnoop- ParErr- Stepping- SERR- FastB2B- DisINTx-
	Status: Cap+ 66MHz- UDF- FastB2B+ ParErr- DEVSEL=fast >TAbort- <TAbort- <MAbort- >SERR- <PERR- INTx-
	Latency: 0
	Interrupt: pin A routed to IRQ 16
	Region 0: Memory at fc000000 (64-bit, non-prefetchable) [size=4M]
	Region 2: Memory at e0000000 (64-bit, prefetchable) [size=256M]
	Region 4: I/O ports at 1c70 [size=8]
	Expansion ROM at 000c0000 [virtual] [disabled] [size=128K]
	Capabilities: <access denied>
	Kernel driver in use: i915
	Kernel modules: i915
00: 86 80 12 2e 07 00 90 00 03 00 00 03 00 00 80 00
10: 04 00 00 fc 00 00 00 00 0c 00 00 e0 00 00 00 00
20: 71 1c 00 00 00 00 00 00 00 00 00 00 aa 17 49 30
30: 00 00 00 00 90 00 00 00 00 00 00 00 03 01 00 00

00:02.1 Display controller [0380]: Intel Corporation 4 Series Chipset Integrated Graphics Controller [8086:2e13] (rev 03)
	Subsystem: Lenovo 4 Series Chipset Integrated Graphics Controller [17aa:3049]
	Control: I/O+ Mem+ BusMaster+ SpecCycle- MemWINV- VGASnoop- ParErr- Stepping- SERR- FastB2B- DisINTx-
	Status: Cap+ 66MHz- UDF- FastB2B+ ParErr- DEVSEL=fast >TAbort- <TAbort- <MAbort- >SERR- <PERR- INTx-
	Latency: 0
	Region 0: Memory at fc400000 (64-bit, non-prefetchable) [size=1M]
	Capabilities: <access denied>
00: 86 80 13 2e 07 00 90 00 03 00 80 03 00 00 80 00
10: 04 00 40 fc 00 00 00 00 00 00 00 00 00 00 00 00
20: 00 00 00 00 00 00 00 00 00 00 00 00 aa 17 49 30
30: 00 00 00 00 d0 00 00 00 00 00 00 00 00 00 00 00

00:03.0 Communication controller [0780]: Intel Corporation 4 Series Chipset HECI Controller [8086:2e14] (rev 03)
	Subsystem: Lenovo 4 Series Chipset HECI Controller [17aa:3049]
	Control: I/O- Mem+ BusMaster+ SpecCycle- MemWINV- VGASnoop- ParErr- Stepping- SERR- FastB2B- DisINTx+
	Status: Cap+ 66MHz- UDF- FastB2B- ParErr- DEVSEL=fast >TAbort- <TAbort- <MAbort- >SERR- <PERR- INTx-
	Latency: 0
	Interrupt: pin A routed to IRQ 28
	Region 0: Memory at fc524000 (64-bit, non-prefetchable) [size=16]
	Capabilities: <access denied>
	Kernel driver in use: mei_me
	Kernel modules: mei_me
00: 86 80 14 2e 06 04 10 00 03 00 80 07 00 00 80 00
10: 04 40 52 fc 00 00 00 00 00 00 00 00 00 00 00 00
20: 00 00 00 00 00 00 00 00 00 00 00 00 aa 17 49 30
30: 00 00 00 00 50 00 00 00 00 00 00 00 03 01 00 00

00:03.2 IDE interface [0101]: Intel Corporation 4 Series Chipset PT IDER Controller [8086:2e16] (rev 03) (prog-if 85 [PCI native mode-only controller, supports bus mastering])
	Subsystem: Lenovo 4 Series Chipset PT IDER Controller [17aa:3049]
	Control: I/O+ Mem- BusMaster- SpecCycle- MemWINV- VGASnoop- ParErr- Stepping- SERR- FastB2B- DisINTx-
	Status: Cap+ 66MHz+ UDF- FastB2B+ ParErr- DEVSEL=fast >TAbort- <TAbort- <MAbort- >SERR- <PERR- INTx-
	Interrupt: pin C routed to IRQ 18
	Region 0: I/O ports at 1c88 [size=8]
	Region 1: I/O ports at 1c7c [size=4]
	Region 2: I/O ports at 1c80 [size=8]
	Region 3: I/O ports at 1c78 [size=4]
	Region 4: I/O ports at 1c40 [size=16]
	Capabilities: <access denied>
	Kernel modules: pata_acpi
00: 86 80 16 2e 01 00 b0 00 03 85 01 01 00 00 00 00
10: 89 1c 00 00 7d 1c 00 00 81 1c 00 00 79 1c 00 00
20: 41 1c 00 00 00 00 00 00 00 00 00 00 aa 17 49 30
30: 00 00 00 00 c8 00 00 00 00 00 00 00 05 03 00 00

00:03.3 Serial controller [0700]: Intel Corporation 4 Series Chipset Serial KT Controller [8086:2e17] (rev 03) (prog-if 02 [16550])
	Subsystem: Lenovo 4 Series Chipset Serial KT Controller [17aa:3049]
	Control: I/O+ Mem+ BusMaster+ SpecCycle- MemWINV- VGASnoop- ParErr- Stepping- SERR- FastB2B- DisINTx-
	Status: Cap+ 66MHz+ UDF- FastB2B+ ParErr- DEVSEL=fast >TAbort- <TAbort- <MAbort- >SERR- <PERR- INTx-
	Latency: 0
	Interrupt: pin B routed to IRQ 17
	Region 0: I/O ports at 1c90 [size=8]
	Region 1: Memory at fc526000 (32-bit, non-prefetchable) [size=4K]
	Capabilities: <access denied>
	Kernel driver in use: serial
00: 86 80 17 2e 07 00 b0 00 03 02 00 07 00 00 00 00
10: 91 1c 00 00 00 60 52 fc 00 00 00 00 00 00 00 00
20: 00 00 00 00 00 00 00 00 00 00 00 00 aa 17 49 30
30: 00 00 00 00 c8 00 00 00 00 00 00 00 0a 02 00 00

00:19.0 Ethernet controller [0200]: Intel Corporation 82567LM-3 Gigabit Network Connection [8086:10de] (rev 02)
	Subsystem: Lenovo 82567LM-3 Gigabit Network Connection [17aa:3049]
	Control: I/O+ Mem+ BusMaster+ SpecCycle- MemWINV- VGASnoop- ParErr- Stepping- SERR+ FastB2B- DisINTx+
	Status: Cap+ 66MHz- UDF- FastB2B- ParErr- DEVSEL=fast >TAbort- <TAbort- <MAbort- >SERR- <PERR- INTx-
	Latency: 0
	Interrupt: pin A routed to IRQ 27
	Region 0: Memory at fc500000 (32-bit, non-prefetchable) [size=128K]
	Region 1: Memory at fc527000 (32-bit, non-prefetchable) [size=4K]
	Region 2: I/O ports at 1820 [size=32]
	Capabilities: <access denied>
	Kernel driver in use: e1000e
	Kernel modules: e1000e
00: 86 80 de 10 07 05 10 00 02 00 00 02 00 00 00 00
10: 00 00 50 fc 00 70 52 fc 21 18 00 00 00 00 00 00
20: 00 00 00 00 00 00 00 00 00 00 00 00 aa 17 49 30
30: 00 00 00 00 c8 00 00 00 00 00 00 00 03 01 00 00

00:1a.0 USB controller [0c03]: Intel Corporation 82801JD/DO (ICH10 Family) USB UHCI Controller #4 [8086:3a67] (rev 02) (prog-if 00 [UHCI])
	Subsystem: Lenovo 82801JD/DO (ICH10 Family) USB UHCI Controller [17aa:3049]
	Control: I/O+ Mem- BusMaster+ SpecCycle- MemWINV- VGASnoop- ParErr- Stepping- SERR- FastB2B- DisINTx-
	Status: Cap+ 66MHz- UDF- FastB2B+ ParErr- DEVSEL=medium >TAbort- <TAbort- <MAbort- >SERR- <PERR- INTx-
	Latency: 0
	Interrupt: pin A routed to IRQ 16
	Region 4: I/O ports at 1840 [size=32]
	Capabilities: <access denied>
	Kernel driver in use: uhci_hcd
00: 86 80 67 3a 05 00 90 02 02 00 03 0c 00 00 80 00
10: 00 00 00 00 00 00 00 00 00 00 00 00 00 00 00 00
20: 41 18 00 00 00 00 00 00 00 00 00 00 aa 17 49 30
30: 00 00 00 00 50 00 00 00 00 00 00 00 03 01 00 00

00:1a.1 USB controller [0c03]: Intel Corporation 82801JD/DO (ICH10 Family) USB UHCI Controller #5 [8086:3a68] (rev 02) (prog-if 00 [UHCI])
	Subsystem: Lenovo 82801JD/DO (ICH10 Family) USB UHCI Controller [17aa:3049]
	Control: I/O+ Mem- BusMaster+ SpecCycle- MemWINV- VGASnoop- ParErr- Stepping- SERR- FastB2B- DisINTx-
	Status: Cap+ 66MHz- UDF- FastB2B+ ParErr- DEVSEL=medium >TAbort- <TAbort- <MAbort- >SERR- <PERR- INTx-
	Latency: 0
	Interrupt: pin B routed to IRQ 17
	Region 4: I/O ports at 1860 [size=32]
	Capabilities: <access denied>
	Kernel driver in use: uhci_hcd
00: 86 80 68 3a 05 00 90 02 02 00 03 0c 00 00 00 00
10: 00 00 00 00 00 00 00 00 00 00 00 00 00 00 00 00
20: 61 18 00 00 00 00 00 00 00 00 00 00 aa 17 49 30
30: 00 00 00 00 50 00 00 00 00 00 00 00 0a 02 00 00

00:1a.2 USB controller [0c03]: Intel Corporation 82801JD/DO (ICH10 Family) USB UHCI Controller #6 [8086:3a69] (rev 02) (prog-if 00 [UHCI])
	Subsystem: Lenovo 82801JD/DO (ICH10 Family) USB UHCI Controller [17aa:3049]
	Control: I/O+ Mem- BusMaster+ SpecCycle- MemWINV- VGASnoop- ParErr- Stepping- SERR- FastB2B- DisINTx-
	Status: Cap+ 66MHz- UDF- FastB2B+ ParErr- DEVSEL=medium >TAbort- <TAbort- <MAbort- >SERR- <PERR- INTx-
	Latency: 0
	Interrupt: pin C routed to IRQ 18
	Region 4: I/O ports at 1880 [size=32]
	Capabilities: <access denied>
	Kernel driver in use: uhci_hcd
00: 86 80 69 3a 05 00 90 02 02 00 03 0c 00 00 00 00
10: 00 00 00 00 00 00 00 00 00 00 00 00 00 00 00 00
20: 81 18 00 00 00 00 00 00 00 00 00 00 aa 17 49 30
30: 00 00 00 00 50 00 00 00 00 00 00 00 05 03 00 00

00:1a.7 USB controller [0c03]: Intel Corporation 82801JD/DO (ICH10 Family) USB2 EHCI Controller #2 [8086:3a6c] (rev 02) (prog-if 20 [EHCI])
	Subsystem: Lenovo 82801JD/DO (ICH10 Family) USB2 EHCI Controller [17aa:3049]
	Control: I/O- Mem+ BusMaster+ SpecCycle- MemWINV- VGASnoop- ParErr- Stepping- SERR+ FastB2B- DisINTx-
	Status: Cap+ 66MHz- UDF- FastB2B+ ParErr- DEVSEL=medium >TAbort- <TAbort- <MAbort- >SERR- <PERR- INTx-
	Latency: 0
	Interrupt: pin C routed to IRQ 18
	Region 0: Memory at fc528000 (32-bit, non-prefetchable) [size=1K]
	Capabilities: <access denied>
	Kernel driver in use: ehci-pci
00: 86 80 6c 3a 06 01 90 02 02 20 03 0c 00 00 00 00
10: 00 80 52 fc 00 00 00 00 00 00 00 00 00 00 00 00
20: 00 00 00 00 00 00 00 00 00 00 00 00 aa 17 49 30
30: 00 00 00 00 50 00 00 00 00 00 00 00 05 03 00 00

00:1b.0 Audio device [0403]: Intel Corporation 82801JD/DO (ICH10 Family) HD Audio Controller [8086:3a6e] (rev 02)
	Subsystem: Lenovo 82801JD/DO (ICH10 Family) HD Audio Controller [17aa:3049]
	Control: I/O- Mem+ BusMaster+ SpecCycle- MemWINV- VGASnoop- ParErr- Stepping- SERR+ FastB2B- DisINTx+
	Status: Cap+ 66MHz- UDF- FastB2B- ParErr- DEVSEL=fast >TAbort- <TAbort- <MAbort- >SERR- <PERR- INTx-
	Latency: 0, Cache Line Size: 32 bytes
	Interrupt: pin A routed to IRQ 29
	Region 0: Memory at fc520000 (64-bit, non-prefetchable) [size=16K]
	Capabilities: <access denied>
	Kernel driver in use: snd_hda_intel
	Kernel modules: snd_hda_intel
00: 86 80 6e 3a 06 05 10 00 02 00 03 04 08 00 00 00
10: 04 00 52 fc 00 00 00 00 00 00 00 00 00 00 00 00
20: 00 00 00 00 00 00 00 00 00 00 00 00 aa 17 49 30
30: 00 00 00 00 50 00 00 00 00 00 00 00 03 01 00 00

00:1d.0 USB controller [0c03]: Intel Corporation 82801JD/DO (ICH10 Family) USB UHCI Controller #1 [8086:3a64] (rev 02) (prog-if 00 [UHCI])
	Subsystem: Lenovo 82801JD/DO (ICH10 Family) USB UHCI Controller [17aa:3049]
	Control: I/O+ Mem- BusMaster+ SpecCycle- MemWINV- VGASnoop- ParErr- Stepping- SERR- FastB2B- DisINTx-
	Status: Cap+ 66MHz- UDF- FastB2B+ ParErr- DEVSEL=medium >TAbort- <TAbort- <MAbort- >SERR- <PERR- INTx-
	Latency: 0
	Interrupt: pin A routed to IRQ 16
	Region 4: I/O ports at 18a0 [size=32]
	Capabilities: <access denied>
	Kernel driver in use: uhci_hcd
00: 86 80 64 3a 05 00 90 02 02 00 03 0c 00 00 80 00
10: 00 00 00 00 00 00 00 00 00 00 00 00 00 00 00 00
20: a1 18 00 00 00 00 00 00 00 00 00 00 aa 17 49 30
30: 00 00 00 00 50 00 00 00 00 00 00 00 03 01 00 00

00:1d.1 USB controller [0c03]: Intel Corporation 82801JD/DO (ICH10 Family) USB UHCI Controller #2 [8086:3a65] (rev 02) (prog-if 00 [UHCI])
	Subsystem: Lenovo 82801JD/DO (ICH10 Family) USB UHCI Controller [17aa:3049]
	Control: I/O+ Mem- BusMaster+ SpecCycle- MemWINV- VGASnoop- ParErr- Stepping- SERR- FastB2B- DisINTx-
	Status: Cap+ 66MHz- UDF- FastB2B+ ParErr- DEVSEL=medium >TAbort- <TAbort- <MAbort- >SERR- <PERR- INTx-
	Latency: 0
	Interrupt: pin B routed to IRQ 17
	Region 4: I/O ports at 18c0 [size=32]
	Capabilities: <access denied>
	Kernel driver in use: uhci_hcd
00: 86 80 65 3a 05 00 90 02 02 00 03 0c 00 00 00 00
10: 00 00 00 00 00 00 00 00 00 00 00 00 00 00 00 00
20: c1 18 00 00 00 00 00 00 00 00 00 00 aa 17 49 30
30: 00 00 00 00 50 00 00 00 00 00 00 00 0a 02 00 00

00:1d.2 USB controller [0c03]: Intel Corporation 82801JD/DO (ICH10 Family) USB UHCI Controller #3 [8086:3a66] (rev 02) (prog-if 00 [UHCI])
	Subsystem: Lenovo 82801JD/DO (ICH10 Family) USB UHCI Controller [17aa:3049]
	Control: I/O+ Mem- BusMaster+ SpecCycle- MemWINV- VGASnoop- ParErr- Stepping- SERR- FastB2B- DisINTx-
	Status: Cap+ 66MHz- UDF- FastB2B+ ParErr- DEVSEL=medium >TAbort- <TAbort- <MAbort- >SERR- <PERR- INTx-
	Latency: 0
	Interrupt: pin C routed to IRQ 18
	Region 4: I/O ports at 18e0 [size=32]
	Capabilities: <access denied>
	Kernel driver in use: uhci_hcd
00: 86 80 66 3a 05 00 90 02 02 00 03 0c 00 00 00 00
10: 00 00 00 00 00 00 00 00 00 00 00 00 00 00 00 00
20: e1 18 00 00 00 00 00 00 00 00 00 00 aa 17 49 30
30: 00 00 00 00 50 00 00 00 00 00 00 00 05 03 00 00

00:1d.7 USB controller [0c03]: Intel Corporation 82801JD/DO (ICH10 Family) USB2 EHCI Controller #1 [8086:3a6a] (rev 02) (prog-if 20 [EHCI])
	Subsystem: Lenovo 82801JD/DO (ICH10 Family) USB2 EHCI Controller [17aa:3049]
	Control: I/O- Mem+ BusMaster+ SpecCycle- MemWINV- VGASnoop- ParErr- Stepping- SERR+ FastB2B- DisINTx-
	Status: Cap+ 66MHz- UDF- FastB2B+ ParErr- DEVSEL=medium >TAbort- <TAbort- <MAbort- >SERR- <PERR- INTx-
	Latency: 0
	Interrupt: pin A routed to IRQ 16
	Region 0: Memory at fc529000 (32-bit, non-prefetchable) [size=1K]
	Capabilities: <access denied>
	Kernel driver in use: ehci-pci
00: 86 80 6a 3a 06 01 90 02 02 20 03 0c 00 00 00 00
10: 00 90 52 fc 00 00 00 00 00 00 00 00 00 00 00 00
20: 00 00 00 00 00 00 00 00 00 00 00 00 aa 17 49 30
30: 00 00 00 00 50 00 00 00 00 00 00 00 03 01 00 00

00:1e.0 PCI bridge [0604]: Intel Corporation 82801 PCI Bridge [8086:244e] (rev a2) (prog-if 01 [Subtractive decode])
	Control: I/O+ Mem+ BusMaster+ SpecCycle- MemWINV- VGASnoop- ParErr- Stepping- SERR+ FastB2B- DisINTx-
	Status: Cap+ 66MHz- UDF- FastB2B- ParErr- DEVSEL=fast >TAbort- <TAbort- <MAbort- >SERR- <PERR- INTx-
	Latency: 0
	Bus: primary=00, secondary=11, subordinate=11, sec-latency=32
	I/O behind bridge: 0000f000-00000fff [disabled]
	Memory behind bridge: fff00000-000fffff [disabled]
	Prefetchable memory behind bridge: 00000000fff00000-00000000000fffff [disabled]
	Secondary status: 66MHz- FastB2B+ ParErr- DEVSEL=medium >TAbort- <TAbort- <MAbort+ <SERR- <PERR-
	BridgeCtl: Parity- SERR+ NoISA+ VGA- VGA16- MAbort- >Reset- FastB2B-
		PriDiscTmr- SecDiscTmr- DiscTmrStat- DiscTmrSERREn-
	Capabilities: <access denied>
00: 86 80 4e 24 07 01 10 00 a2 01 04 06 00 00 01 00
10: 00 00 00 00 00 00 00 00 00 11 11 20 f0 00 80 22
20: f0 ff 00 00 f1 ff 01 00 00 00 00 00 00 00 00 00
30: 00 00 00 00 50 00 00 00 00 00 00 00 ff 00 06 00

00:1f.0 ISA bridge [0601]: Intel Corporation 82801JDO (ICH10DO) LPC Interface Controller [8086:3a14] (rev 02)
	Subsystem: Lenovo 82801JDO (ICH10DO) LPC Interface Controller [17aa:3049]
	Control: I/O+ Mem+ BusMaster+ SpecCycle- MemWINV- VGASnoop- ParErr- Stepping- SERR- FastB2B- DisINTx-
	Status: Cap+ 66MHz- UDF- FastB2B- ParErr- DEVSEL=medium >TAbort- <TAbort- <MAbort- >SERR- <PERR- INTx-
	Latency: 0
	Capabilities: <access denied>
	Kernel driver in use: lpc_ich
	Kernel modules: lpc_ich
00: 86 80 14 3a 07 00 10 02 02 00 01 06 00 00 80 00
10: 00 00 00 00 00 00 00 00 00 00 00 00 00 00 00 00
20: 00 00 00 00 00 00 00 00 00 00 00 00 aa 17 49 30
30: 00 00 00 00 e0 00 00 00 00 00 00 00 00 00 00 00

00:1f.2 SATA controller [0106]: Intel Corporation 82801JD/DO (ICH10 Family) SATA AHCI Controller [8086:3a02] (rev 02) (prog-if 01 [AHCI 1.0])
	Subsystem: Lenovo 82801JD/DO (ICH10 Family) SATA AHCI Controller [17aa:3049]
	Control: I/O+ Mem+ BusMaster+ SpecCycle- MemWINV- VGASnoop- ParErr- Stepping- SERR- FastB2B- DisINTx+
	Status: Cap+ 66MHz+ UDF- FastB2B+ ParErr- DEVSEL=medium >TAbort- <TAbort- <MAbort- >SERR- <PERR- INTx-
	Latency: 0
	Interrupt: pin B routed to IRQ 26
	Region 0: I/O ports at 1ca8 [size=8]
	Region 1: I/O ports at 1c9c [size=4]
	Region 2: I/O ports at 1ca0 [size=8]
	Region 3: I/O ports at 1c98 [size=4]
	Region 4: I/O ports at 1c00 [size=32]
	Region 5: Memory at fc52a000 (32-bit, non-prefetchable) [size=2K]
	Capabilities: <access denied>
	Kernel driver in use: ahci
	Kernel modules: ahci
00: 86 80 02 3a 07 04 b0 02 02 01 06 01 00 00 00 00
10: a9 1c 00 00 9d 1c 00 00 a1 1c 00 00 99 1c 00 00
20: 01 1c 00 00 00 a0 52 fc 00 00 00 00 aa 17 49 30
30: 00 00 00 00 80 00 00 00 00 00 00 00 0a 02 00 00

00:1f.3 SMBus [0c05]: Intel Corporation 82801JD/DO (ICH10 Family) SMBus Controller [8086:3a60] (rev 02)
	Subsystem: Lenovo 82801JD/DO (ICH10 Family) SMBus Controller [17aa:3049]
	Control: I/O+ Mem+ BusMaster- SpecCycle- MemWINV- VGASnoop- ParErr- Stepping- SERR- FastB2B- DisINTx-
	Status: Cap- 66MHz- UDF- FastB2B+ ParErr- DEVSEL=medium >TAbort- <TAbort- <MAbort- >SERR- <PERR- INTx-
	Interrupt: pin B routed to IRQ 17
	Region 0: Memory at fc52b000 (64-bit, non-prefetchable) [size=256]
	Region 4: I/O ports at 1c20 [size=32]
	Kernel driver in use: i801_smbus
	Kernel modules: i2c_i801
00: 86 80 60 3a 03 00 80 02 02 00 05 0c 00 00 00 00
10: 04 b0 52 fc 00 00 00 00 00 00 00 00 00 00 00 00
20: 21 1c 00 00 00 00 00 00 00 00 00 00 aa 17 49 30
30: 00 00 00 00 00 00 00 00 00 00 00 00 0a 02 00 00

